"Key","Item Type","Publication Year","Author","Title","Publication Title","ISBN","ISSN","DOI","Url","Abstract Note","Date","Date Added","Date Modified","Access Date","Pages","Num Pages","Issue","Volume","Number Of Volumes","Journal Abbreviation","Short Title","Series","Series Number","Series Text","Series Title","Publisher","Place","Language","Rights","Type","Archive","Archive Location","Library Catalog","Call Number","Extra","Notes","File Attachments","Link Attachments","Manual Tags","Automatic Tags","Editor","Series Editor","Translator","Contributor","Attorney Agent","Book Author","Cast Member","Commenter","Composer","Cosponsor","Counsel","Interviewer","Producer","Recipient","Reviewed Author","Scriptwriter","Words By","Guest","Number","Edition","Running Time","Scale","Medium","Artwork Size","Filing Date","Application Number","Assignee","Issuing Authority","Country","Meeting Name","Conference Name","Court","References","Reporter","Legal Status","Priority Numbers","Programming Language","Version","System","Code","Code Number","Section","Session","Committee","History","Legislative Body"
"WIJ2B2RF","journalArticle","2009","Ga\"" el, Guilloux","Ecodesign, du contexte au produit : contribution m\' ethodologique \` a l'int\' egration de l'environnement dans les m\' etiers du design industriel","","","","","","","2009","2025-03-04 22:12:05","2025-03-04 22:12:05","","","","","","","","","","","","","","","","","","","","","","","","","","","","","","","","","","","","","","","","","","","","","","","","","","","","","","","","","","","","","","","","","","","","","","","","",""
"HM33BVIH","journalArticle","2014","C., Lecomte","Ing\' enierie frugale pour les bases de la Pyramide : concevoir des produits ouverts pour des contextes multiples","","","","","","","2014","2025-03-04 22:12:05","2025-03-04 22:12:05","","","","","","","","","","","","","","","","","","","","","","","","","","","","","","","","","","","","","","","","","","","","","","","","","","","","","","","","","","","","","","","","","","","","","","","","",""
"63G2UWHW","journalArticle","2015","Brieuc, Saffr\' e; Nicolas, Buttin","Activer l'\' economie circulaire : Comment r\' econcilier l'\' economie et la nature Ed. 1","","","","","","","2015","2025-03-04 22:12:05","2025-03-04 22:12:05","","","","","","","","","","","","","","","","","","","","","","","","","","","","","","","","","","","","","","","","","","","","","","","","","","","","","","","","","","","","","","","","","","","","","","","","",""
"2HSPQ35F","journalArticle","","Masson, Josselin","EFFETS DE LA MODIFICATION D’UN ATTRIBUT CONSTITUTIF D’UN PRODUIT ALIMENTAIRE SUR SON ADOPTION PAR LES CONSOMMATEURS : LE CAS DU VIN A TENEUR REDUITE EN ALCOOL","","","","","","In the marketing literature which focuses on innovation adoption by consumers, the adoption process is explained mostly by consumer innovativeness. However, some research works show that the new product’s perceived cues can better explain its adoption than individual characteristics. Our work lies in the latter perspective and contributes to explain cognitive and sensory mechanisms of adoption, making a careful distinction between extrinsic and intrinsic effects of new product cues. Moreover, most research works use unique and immediate measurements while it appears necessary to make repeated measurements. Therefore, we implement longitudinal methodologies in this research. Three experimentations show lower quality expectations with the modified non-sensory cue (reduced alcohol content) than with the usual non-sensory cue (normal alcohol content). However, perception of this non-sensory information on modification is not sufficiently negative to reduce the overall perceived quality of the new product which remains close to that of the regular product. Therefore, both judging by its taste and conceptually, a new food product (i.e. low-alcohol wine) seems acceptable, at least as long as it does not move away too far from limits of the products category to which it belongs.","","2025-03-10 10:29:56","2025-03-10 10:29:57","","","","","","","","","","","","","","","fr","","","","","Zotero","","","","/Users/camillejeanningros/Zotero/storage/ICT49W5I/Masson - EFFETS DE LA MODIFICATION D’UN ATTRIBUT CONSTITUTIF D’UN PRODUIT ALIMENTAIRE SUR SON ADOPTION PAR LE.pdf","","","","","","","","","","","","","","","","","","","","","","","","","","","","","","","","","","","","","","","","","","","","","","","","",""
"4UAYD2ZJ","journalArticle","2020","Santos, João A.; Fraga, Helder; Malheiro, Aureliano C.; Moutinho-Pereira, José; Dinis, Lia-Tânia; Correia, Carlos; Moriondo, Marco; Leolini, Luisa; Dibari, Camilla; Costafreda-Aumedes, Sergi; Kartschall, Thomas; Menz, Christoph; Molitor, Daniel; Junk, Jürgen; Beyer, Marco; Schultz, Hans R.","A Review of the Potential Climate Change Impacts and Adaptation Options for European Viticulture","Applied Sciences","","2076-3417","10.3390/app10093092","https://www.mdpi.com/2076-3417/10/9/3092","Viticulture and winemaking are important socioeconomic sectors in many European regions. Climate plays a vital role in the terroir of a given wine region, as it strongly controls canopy microclimate, vine growth, vine physiology, yield, and berry composition, which together determine wine attributes and typicity. New challenges are, however, predicted to arise from climate change, as grapevine cultivation is deeply dependent on weather and climate conditions. Changes in viticultural suitability over the last decades, for viticulture in general or the use of speciﬁc varieties, have already been reported for many wine regions. Despite spatially heterogeneous impacts, climate change is anticipated to exacerbate these recent trends on suitability for wine production. These shifts may reshape the geographical distribution of wine regions, while wine typicity may also be threatened in most cases. Changing climates will thereby urge for the implementation of timely, suitable, and cost-eﬀective adaptation strategies, which should also be thoroughly planned and tuned to local conditions for an eﬀective risk reduction. Although the potential of the diﬀerent adaptation options is not yet fully investigated, deserving further research activities, their adoption will be of utmost relevance to maintain the socioeconomic and environmental sustainability of the highly valued viticulture and winemaking sector in Europe.","2020-04-29","2025-03-10 10:30:27","2025-03-10 10:30:27","2025-03-10 10:30:27","3092","","9","10","","Applied Sciences","","","","","","","","en","https://creativecommons.org/licenses/by/4.0/","","","","DOI.org (Crossref)","","","","/Users/camillejeanningros/Zotero/storage/DUMRJRVZ/Santos et al. - 2020 - A Review of the Potential Climate Change Impacts and Adaptation Options for European Viticulture.pdf","","","","","","","","","","","","","","","","","","","","","","","","","","","","","","","","","","","","","","","","","","","","","","","","",""
"HMEKHCDF","journalArticle","2021","Marín, D.; Armengol, J.; Carbonell‐Bejerano, P.; Escalona, J.M.; Gramaje, D.; Hernández‐Montes, E.; Intrigliolo, D.S.; Martínez‐Zapater, J.M.; Medrano, H.; Mirás‐Avalos, J.M.; Palomares‐Rius, J.E.; Romero‐Azorín, P.; Savé, R.; Santesteban, L.G.; De Herralde, F.","Challenges of viticulture adaptation to global change: tackling the issue from the roots","Australian Journal of Grape and Wine Research","","1322-7130, 1755-0238","10.1111/ajgw.12463","https://onlinelibrary.wiley.com/doi/10.1111/ajgw.12463","Viticulture is facing emerging challenges not only because of the effect of climate change on yield and composition of grapes, but also of a social demand for environmental-friendly agricultural management. Adaptation to these challenges is essential to guarantee the sustainability of viticulture. The aim of this review is to present adaptation possibilities from the soil-hidden, and often disregarded, part of the grapevine, the roots. The complexity of soil–root interactions makes necessary a comprehensive approach taking into account physiology, pathology and genetics, in order to outline strategies to improve viticulture adaptation to current and future threats. Rootstocks are the link between soil and scion in grafted crops, and they have played an essential role in viticulture since the introduction of phylloxera into Europe at the end of the 19th century. This review outlines current and future challenges that are threatening the sustainability of the wine sector and the relevant role that rootstocks can play to face these threats. We describe how rootstocks along with soil management can be exploited as an essential tool to deal with the effects of climate change and of emerging soil-borne pests and pathogens. Moreover, we discuss the possibilities and limitations of diverse genetic strategies for rootstock breeding.","2021-01","2025-03-10 10:30:42","2025-03-10 10:30:42","2025-03-10 10:30:42","8-25","","1","27","","Australian Journal of Grape and Wine Research","Challenges of viticulture adaptation to global change","","","","","","","en","","","","","DOI.org (Crossref)","","","","/Users/camillejeanningros/Zotero/storage/5JV6SI3A/Marín et al. - 2021 - Challenges of viticulture adaptation to global change tackling the issue from the roots.pdf","","","","","","","","","","","","","","","","","","","","","","","","","","","","","","","","","","","","","","","","","","","","","","","","",""
"DRUAKEXQ","journalArticle","","Caillon, Sophie","Trajectoire d'une ethnoécologue: de l'agrobiodiversité au bien-être","","","","","","","","2025-03-10 10:31:03","2025-03-10 10:31:03","","","","","","","","","","","","","","","fr","","","","","Zotero","","","","/Users/camillejeanningros/Zotero/storage/IIXY6DDU/Caillon - Trajectoire d'une ethnoécologue de l'agrobiodiversité au bien-être.pdf","","","","","","","","","","","","","","","","","","","","","","","","","","","","","","","","","","","","","","","","","","","","","","","","",""
"FI7G6ZE9","book","2015","Dedieu, Benoît; Institut national de la recherche agronomique","L'agriculture en famille: travailler, réinventer, transmettre","","978-2-7598-1192-2","","","","","2015","2025-03-10 10:31:17","2025-03-10 10:31:17","","","","","","","","L'agriculture en famille","PROfil","","","","EDP sciences","Les Ulis","fr","","","","","BnF ISBN","338.109 4409051","","","/Users/camillejeanningros/Zotero/storage/ABIUE2QD/Dedieu - 2015 - L'agriculture en famille travailler, réinventer, transmettre.pdf","","","","","","","Institut national de la recherche agronomique","","","","","","","","","","","","","","","","","","","","","","","","","","","","","","","","","","","","","","","","","",""
"QS7ZYGUG","journalArticle","","Konan, Marie Yvette Elisée","Compétitivité des entreprises et dépérissement du vignoble","","","","","","","","2025-03-10 10:31:29","2025-03-10 10:31:29","","","","","","","","","","","","","","","fr","","","","","Zotero","","","","/Users/camillejeanningros/Zotero/storage/227WFNAC/Konan - Compétitivité des entreprises et dépérissement du vignoble.pdf","","","","","","","","","","","","","","","","","","","","","","","","","","","","","","","","","","","","","","","","","","","","","","","","",""
"E9WIPXXC","journalArticle","","Chanfreau, Alix","Les vignerons face aux défi des jeunes consommateurs","","","","","","","","2025-03-10 10:40:04","2025-03-10 10:40:04","","","","","","","","","","","","","","","fr","","","","","Zotero","","","","/Users/camillejeanningros/Zotero/storage/D5EH7J2I/Chanfreau - Les vignerons face aux défi des jeunes consommateurs.pdf","","","","","","","","","","","","","","","","","","","","","","","","","","","","","","","","","","","","","","","","","","","","","","","","",""
"6PBUMPEC","webpage","","","L’avenir des vins et spiritueux à l’horizon 2030 vu par les professionnels de la filière","Agro Media","","","","https://www.agro-media.fr/dossier/lavenir-des-vins-et-spiritueux-a-lhorizon-2030-vu-par-les-professionnels-du-secteur-56003.html/","Organisé par Vinexposium en juin dernier, le Symposium « Act for Change » a réuni 35 experts internationaux de 17 nationalités autour d’une série de débats prospectifs sur l’av","","2025-03-17 13:29:57","2025-03-17 13:29:57","2025-03-17 13:29:46","","","","","","","","","","","","","","fr-FR","","","","","","","","","false","https://www.agro-media.fr/dossier/lavenir-des-vins-et-spiritueux-a-lhorizon-2030-vu-par-les-professionnels-du-secteur-56003.html","","","","","","","","","","","","","","","","","","","","","","","","","","","","","","","","","","","","","","","","","","","","","","","",""
"GCSFPSEX","webpage","","","""L'industrie du vin devient de plus en plus imprévisible, la géopolitique n'est qu'un des nombreux défis""","","","","","https://www.vitisphere.com/https:/www.vitisphere.com/actualite-103984-lindustrie-du-vin-devient-de-plus-en-plus-imprvisible-la-gopolitique-nest-quun-des-nombreux-dfis.html","C’est le défi d’avenir des vignerons et négociants : conquérir de nouveaux consommateurs, qu’il s’agisse des jeunes sur des marchés établis en déclin ou","","2025-03-17 13:31:17","2025-03-17 13:31:17","2025-03-17 13:31:17","","","","","","","","","","","","","","fr","","","","","","","","","/Users/camillejeanningros/Zotero/storage/E6S6XGUA/actualite-103984-lindustrie-du-vin-devient-de-plus-en-plus-imprvisible-la-gopolitique-nest-quun.html","","","","","","","","","","","","","","","","","","","","","","","","","","","","","","","","","","","","","","","","","","","","","","","","",""
"VINDQD37","webpage","2016","","Ces start-up françaises qui révolutionnent la viticulture","","","","","https://www.bpifrance.fr/nos-actualites/ces-start-francaises-qui-revolutionnent-la-viticulture","Alors que la filière viticole française est mondialement reconnue pour la qualité de son savoir-faire, plusieurs solutions innovantes ont émergé grâce à de jeunes pousses spécialisées dans les nouvelles technologies et le numérique.","2016-12-26","2025-03-17 13:31:30","2025-03-17 13:31:30","2025-03-17 13:31:30","","","","","","","","","","","","","","fr","","","","","","","","","","","","","","","","","","","","","","","","","","","","","","","","","","","","","","","","","","","","","","","","","","","","","","","","","",""
"9V2B326Q","blogPost","2022","Connect_TV","Vin bio, responsable, naturel, biodynamie… Comment s’y retrouver?","Terra Vitis","","","","https://terravitis.com/vin-bio-vin-responsable-vin-naturel-biodynamie-quelles-differences/","Quelles sont les principales certifications du secteur viticole ? Quelles différences entre un vin bio et un vin TERRA VITIS ? On vous dit tout !","2022-06-29","2025-03-17 13:31:39","2025-03-17 13:31:39","2025-03-17 13:31:39","","","","","","","","","","","","","","fr-FR","","","","","","","","","","","","","","","","","","","","","","","","","","","","","","","","","","","","","","","","","","","","","","","","","","","","","","","","","",""
"IHLE9H3G","webpage","","","Filles de Vignes, hors-série : Table ronde « Existe-t-il un féminisme viticole ? » | RadioVino","","","","","https://www.radiovino.fr/filles-de-vignes-hors-serie-table-ronde-existe-t-il-un-feminisme-viticole/","","","2025-03-17 21:55:27","2025-03-17 21:55:27","2025-03-17 21:55:27","","","","","","","Filles de Vignes, hors-série","","","","","","","fr-FR","","","","","","","","","/Users/camillejeanningros/Zotero/storage/4IAEBDD2/filles-de-vignes-hors-serie-table-ronde-existe-t-il-un-feminisme-viticole.html","","","","","","","","","","","","","","","","","","","","","","","","","","","","","","","","","","","","","","","","","","","","","","","","",""
"PPSXQZYM","webpage","","","Les femmes et la vigne. une histoire économique et sociale - 1850-2010","Le serveur de diffusion de l'université Bourgogne europe","","","","https://mediaserveur.u-bourgogne.fr/permalink/v125ce60084218p7luk7/","","","2025-03-18 21:47:24","2025-03-18 21:47:56","2025-03-18 21:47:24","","","","","","","","","","","","","","fr","","","","","","","","","/Users/camillejeanningros/Zotero/storage/FS4A4TXF/iframe.html","","","","","","","","","","","","","","","","","","","","","","","","","","","","","","","","","","","","","","","","","","","","","","","","",""
"SPRGMN9N","webpage","","Guillaume Bodin","La clef des terroirs - film documentaire français","YouTube","","","","https://www.youtube.com/channel/UC2aS43Ze7H_L-7FZyCuHQiA","🍷 🎥 Vigneron-Cinéaste & 🏔️⛷️🧗‍♂️🚴‍♂️👨‍🌾🍾","","2025-03-18 21:48:14","2025-03-18 21:52:04","2025-03-18 21:48:14","","","","","","","","","","","","","","fr-FR","","","","","","","","","/Users/camillejeanningros/Zotero/storage/78RN5C5Q/watch.html","","","","","","","","","","","","","","","","","","","","","","","","","","","","","","","","","","","","","","","","","","","","","","","","",""
"HIGSC9UC","journalArticle","2018","Zancarini-Fournel, Michelle","Jean-Louis Escudier, Les Femmes et la vigne. Une histoire économique et sociale (1850-2010)","Clio. Femmes, Genre, Histoire","","1252-7017","10.4000/clio.15503","https://journals.openedition.org/clio/15503","Du travail des femmes dans la viticulture nous connaissions au mieux l’article de 1979 de Laura Frader sur les femmes et leurs familles dans les luttes viticoles de l’Aude avant la guerre de 1914 ou encore les entretiens recueillis par un collectif d’historiennes et d’anthropologues de Toulouse, publiés en 1981 dans un petit livre à couverture jaune par l’Atelier du Gué. C’est dire à quel point la synthèse de Jean-Louis Escudier envisagée dans la longue durée vient combler un manque. En se ré...","2018-12-01","2025-03-19 08:18:53","2025-03-19 08:18:53","2025-03-19 08:18:53","","","48","","","","","","","","","","","fr","All rights reserved","","","","journals.openedition.org","","Number: 48 Publisher: Éditions Belin","","/Users/camillejeanningros/Zotero/storage/6QHLECD3/Zancarini-Fournel - 2018 - Jean-Louis Escudier, Les Femmes et la vigne. Une histoire économique et sociale (1850-2010).pdf","","","","","","","","","","","","","","","","","","","","","","","","","","","","","","","","","","","","","","","","","","","","","","","","",""
"RDS9HGSM","blogPost","2024","worldwinewomen","Les vigneronnes auraient-elles une conscience écologique plus aboutie que les vignerons ?","AgriGenre","","","","https://agrigenre.hypotheses.org/22102","Ce texte est la troisième publication d'une longue série portant sur l'écoféminisme et la viticulture. La dernière publication sera en ligne le mois prochain. Bonnes lectures ! Nous avons réalisé une enquête statistique sur un échantillon de 172 vignerons et vigneronnes (51% de femmes) afin de vérifier l’observation sur le terrain de la différence de … Continuer la lecture de Les vigneronnes auraient-elles une conscience écologique plus aboutie que les vignerons ? →","2024-11-01","2025-03-19 08:25:19","2025-03-19 08:25:19","2025-03-19 08:25:19","","","","","","","","","","","","","","fr-FR","","Billet","","","","","ISSN: 2726-3819 DOI: 10.58079/12lqs","","/Users/camillejeanningros/Zotero/storage/KQSQYKGB/22102.html","","","","","","","","","","","","","","","","","","","","","","","","","","","","","","","","","","","","","","","","","","","","","","","","",""
"KYP32Z5S","blogPost","2024","Rochard, Jean andré","Coupes budgétaires du Christelle Morançais : 698 acteurs culturels écrivent à Edouard Philippe","Média Web","","","","https://media-web.fr/coupes-budgetaires-du-christelle-morancais-658-acteurs-culturels-ecrivent-a-edouard-philippe/","Christelle Morançais n’en finit pas d’attirer les foudres de toutes parts suite à ses décisions de coupes budgétaires sans concertation. Une lettre ouverte des acteurs culturels de la région Pays de la Loire à Monsieur Édouard Philippe, président du parti Horizons, candidat à la prochaine élection présidentielle. Monsieur le Premier ministre, Par cette lettre ouverte, […]","2024-12-16","2025-03-20 20:05:24","2025-03-20 20:05:24","2025-03-20 20:05:24","","","","","","","Coupes budgétaires du Christelle Morançais","","","","","","","fr-FR","","","","","","","","","/Users/camillejeanningros/Zotero/storage/EI3VIHKB/coupes-budgetaires-du-christelle-morancais-658-acteurs-culturels-ecrivent-a-edouard-philippe.html","","","","","","","","","","","","","","","","","","","","","","","","","","","","","","","","","","","","","","","","","","","","","","","","",""
"2Q2QLHFD","webpage","2024","Dumas, Thibault","La liste des coupes budgétaires de la région Pays de la Loire","","","","","https://www.mediacites.fr/decryptage/nantes/2024/11/28/la-liste-des-coupes-budgetaires-de-la-region-pays-de-la-loire/","Une trentaine d’interlocuteurs contactés et une centaine de documents de travail internes à la région Pays de la Loire consultés. Sur cette base, Mediacités peut retracer la route périlleuse qu’emprunte la présidente (Horizons) Christelle Morançais pour faire adopter le 19 décembre prochain un budget, amputé sur 1,2 milliard de dépenses de fonctionnement en 2024. Depuis","2024-11-28","2025-03-20 20:10:52","2025-03-20 20:10:52","2025-03-20 20:10:52","","","","","","","","","","","","","","fr-FR","","","","","","","","","/Users/camillejeanningros/Zotero/storage/62K6WV9R/la-liste-des-coupes-budgetaires-de-la-region-pays-de-la-loire.html","","","","","","","","","","","","","","","","","","","","","","","","","","","","","","","","","","","","","","","","","","","","","","","","",""
"U732M75J","webpage","2024","ROBIN, Claire","Coupes budgétaires en Pays de la Loire. Les syndicats agricoles touchés eux aussi","Ouest-France.fr","","","","https://www.ouest-france.fr/economie/agriculture/coupes-budgetaires-en-pays-de-la-loire-les-syndicats-agricoles-touches-eux-aussi-8f5dafce-acb0-11ef-9f0f-abd6acfb270c","Les restrictions budgétaires toucheront aussi l’agriculture régionale. En Pays de la Loire, les instances régionales des syndicats agricoles (FRSEA, JA, Confédération paysanne et Coordination rurale) vont devoir faire sans leur subvention régionale à partir de 2025.","2024-11-27","2025-03-20 20:10:59","2025-03-20 20:10:59","2025-03-20 20:10:59","","","","","","","","","","","","","","fr","","","","","","","Section: Agriculture","","","","","","","","","","","","","","","","","","","","","","","","","","","","","","","","","","","","","","","","","","","","","","","","","","",""
"6WHTKUAP","blogPost","2025","worldwinewomen","Vigneronne | AgriGenre","","","","","https://agrigenre.hypotheses.org/tag/vigneronne","","2025-01-01","2025-03-20 20:25:19","2025-03-20 20:25:26","2025-03-20 20:25:19","","","","","","","","","","","","","","fr-FR","","","","","","","ISSN: 2726-3819","","/Users/camillejeanningros/Zotero/storage/DS8NQVCI/vigneronne.html","","","","","","","","","","","","","","","","","","","","","","","","","","","","","","","","","","","","","","","","","","","","","","","","",""
"DZDNKIRL","webpage","2025","","TÉMOIGNAGE. ""Parfois, je n’ai plus envie de travailler dans le monde du vin"" : neuf agressions sexuelles en huit ans pour cette vigneronne","France 3 Occitanie","","","","https://france3-regions.francetvinfo.fr/occitanie/gard/nimes/temoignage-parfois-je-n-ai-plus-envie-de-travailler-dans-le-monde-du-vin-neuf-agressions-sexuelles-en-huit-ans-pour-cette-vigneronne-3111694.html","Le milieu viticole est encore aujourd’hui particulièrement masculin, mais de plus en plus de femmes tentent de se faire une place. Pour autant, la situation n’est pas toujours facile, et nombreuses sont celles qui dénoncent...","2025-02-23","2025-03-26 13:21:22","2025-03-26 13:21:22","2025-03-26 13:21:22","","","","","","","TÉMOIGNAGE. ""Parfois, je n’ai plus envie de travailler dans le monde du vin""","","","","","","","fr-FR","","","","","","","","","/Users/camillejeanningros/Zotero/storage/RN9LWQFQ/temoignage-parfois-je-n-ai-plus-envie-de-travailler-dans-le-monde-du-vin-neuf-agressions-sexuel.html","","","","","","","","","","","","","","","","","","","","","","","","","","","","","","","","","","","","","","","","","","","","","","","","",""
"UY2J6WDJ","webpage","","","La ferme HI bride, Villelaure | matali crasset","","","","","https://www.matalicrasset.com/fr/projet/la-ferme-hi-bride-villelaure","","","2025-03-26 18:42:17","2025-03-26 18:42:17","2025-03-26 18:42:17","","","","","","","","","","","","","","","","","","","","","","","","","","","","","","","","","","","","","","","","","","","","","","","","","","","","","","","","","","","","","","","","","","","","","","","",""
"JQJNRSBZ","webpage","","","S'installer en agriculture - Pays de la Loire - S'installer en agriculture - Pays de la Loire","","","","","https://pays-de-la-loire.sinstallerenagriculture.fr/","","","2025-03-27 22:26:07","2025-03-27 22:26:07","2025-03-27 22:26:07","","","","","","","","","","","","","","","","","","","","","","","","","","","","","","","","","","","","","","","","","","","","","","","","","","","","","","","","","","","","","","","","","","","","","","","",""
"BPNI6KND","webpage","","","CIAP Pays de la Loire – Coopérative d'Installation en Agriculture Paysanne","","","","","https://ciap-pdl.fr/","","","2025-03-27 22:26:16","2025-03-27 22:26:16","2025-03-27 22:26:16","","","","","","","","","","","","","","","","","","","","","","","","","","","","","","","","","","","","","","","","","","","","","","","","","","","","","","","","","","","","","","","","","","","","","","","",""
